Enter password:
Welcome to the MySQL monitor.  Commands end with ; or \g.
Your MySQL connection id is 28
Server version: 8.3.0 MySQL Community Server - GPL

Copyright (c) 2000, 2024, Oracle and/or its affiliates.

Oracle is a registered trademark of Oracle Corporation and/or its
affiliates. Other names may be trademarks of their respective
owners.

Type 'help;' or '\h' for help. Type '\c' to clear the current input statement.

mysql> create database DBMS_Final_exam;
Query OK, 1 row affected (0.01 sec)

mysql> use DBMS_Final_exam;
Database changed

Q1.

mysql> create table Client_master(ClientNO varchar(50), Name varchar(50), Address varchar(50), City varchar(50), State varchar(50), bal_due int);
Query OK, 0 rows affected (0.01 sec)

mysql> desc client_master;
+----------+-------------+------+-----+---------+-------+
| Field    | Type        | Null | Key | Default | Extra |
+----------+-------------+------+-----+---------+-------+
| ClientNO | varchar(50) | YES  |     | NULL    |       |
| Name     | varchar(50) | YES  |     | NULL    |       |
| Address  | varchar(50) | YES  |     | NULL    |       |
| City     | varchar(50) | YES  |     | NULL    |       |
| State    | varchar(50) | YES  |     | NULL    |       |
| bal_due  | int         | YES  |     | NULL    |       |
+----------+-------------+------+-----+---------+-------+
6 rows in set (0.00 sec)

Q2.

mysql> insert into Client_master VALUES('C100','Peter','Gasabo','Kigali','Kigali', 1000);
Query OK, 1 row affected (0.00 sec)

mysql> select * from client_master;
+----------+-------+---------+--------+--------+---------+
| ClientNO | Name  | Address | City   | State  | bal_due |
+----------+-------+---------+--------+--------+---------+
| C100     | Peter | Gasabo  | Kigali | Kigali |    1000 |
+----------+-------+---------+--------+--------+---------+
1 row in set (0.00 sec)

mysql> insert into Client_master VALUES('C120','john','wester','karongi','kibuye', 2000);
Query OK, 1 row affected (0.00 sec)

mysql> insert into Client_master VALUES('C123','jeane','wester','Namasheke','cyangugu', 3000);
Query OK, 1 row affected (0.00 sec)

mysql> insert into Client_master VALUES('C125','emmy','south','nyaruguru','gikongoro', 6000);
Query OK, 1 row affected (0.00 sec)

mysql> insert into Client_master VALUES('C128','esther','north','gatsibo','byumba', 7000);
Query OK, 1 row affected (0.00 sec)


mysql> select * from client_master;
+----------+--------+---------+-----------+-----------+---------+
| ClientNO | Name   | Address | City      | State     | bal_due |
+----------+--------+---------+-----------+-----------+---------+
| C100     | Peter  | Gasabo  | Kigali    | Kigali    |    1000 |
| C120     | john   | wester  | karongi   | kibuye    |    2000 |
| C123     | jeane  | wester  | Namasheke | cyangugu  |    3000 |
| C125     | emmy   | south   | nyaruguru | gikongoro |    6000 |
| C128     | esther | north   | gatsibo   | byumba    |    7000 |
+----------+--------+---------+-----------+-----------+---------+
5 rows in set (0.00 sec)

mysql> select name from client_master where bal_due > 5000;
+--------+
| name   |
+--------+
| emmy   |
| esther |
+--------+
2 rows in set (0.00 sec)

Q3.

mysql> alter table client_master change column baldue bal_due varchar(50);
Query OK, 0 rows affected (0.02 sec)
Records: 0  Duplicates: 0  Warnings: 0

mysql> desc client_master;
+----------+-------------+------+-----+---------+-------+
| Field    | Type        | Null | Key | Default | Extra |
+----------+-------------+------+-----+---------+-------+
| ClientNO | varchar(50) | YES  |     | NULL    |       |
| Name     | varchar(50) | YES  |     | NULL    |       |
| Address  | varchar(50) | YES  |     | NULL    |       |
| City     | varchar(50) | YES  |     | NULL    |       |
| State    | varchar(50) | YES  |     | NULL    |       |
| bal_due  | varchar(50) | YES  |     | NULL    |       |
+----------+-------------+------+-----+---------+-------+
6 rows in set (0.00 sec)

mysql> select * from client_master;
+----------+--------+---------+-----------+-----------+---------+
| ClientNO | Name   | Address | City      | State     | bal_due |
+----------+--------+---------+-----------+-----------+---------+
| C100     | Peter  | Gasabo  | Kigali    | Kigali    | 1000    |
| C120     | john   | wester  | karongi   | kibuye    | 2000    |
| C123     | jeane  | wester  | Namasheke | cyangugu  | 3000    |
| C125     | emmy   | south   | nyaruguru | gikongoro | 6000    |
| C128     | esther | north   | gatsibo   | byumba    | 7000    |
+----------+--------+---------+-----------+-----------+---------+
5 rows in set (0.00 sec)

mysql> update client_master set bal_due = 'Rs. 5100' where ClientNO = 'C123';
Query OK, 1 row affected (0.00 sec)
Rows matched: 1  Changed: 1  Warnings: 0

mysql> select * from client_master;
+----------+--------+---------+-----------+-----------+----------+
| ClientNO | Name   | Address | City      | State     | bal_due  |
+----------+--------+---------+-----------+-----------+----------+
| C100     | Peter  | Gasabo  | Kigali    | Kigali    | 1000     |
| C120     | john   | wester  | karongi   | kibuye    | 2000     |
| C123     | jeane  | wester  | Namasheke | cyangugu  | Rs. 5100 |
| C125     | emmy   | south   | nyaruguru | gikongoro | 6000     |
| C128     | esther | north   | gatsibo   | byumba    | 7000     |
+----------+--------+---------+-----------+-----------+----------+
5 rows in set (0.00 sec)

Q4.

mysql> rename table Client_master to Client12;
Query OK, 0 rows affected (0.01 sec)

mysql> show tables;
+---------------------------+
| Tables_in_dbms_final_exam |
+---------------------------+
| client12                  |
+---------------------------+
1 row in set (0.00 sec)

Q5.

mysql> select bal_due as BARANCE from client12;
+----------+
| BARANCE  |
+----------+
| 1000     |
| 2000     |
| Rs. 5100 |
| 6000     |
| 7000     |
+----------+
5 rows in set (0.00 sec)

Q6.

mysql> CREATE TABLE departments(
    ->     department_id INT AUTO_INCREMENT PRIMARY KEY,
    ->     department_name VARCHAR(100) NOT NULL,
    ->     manager_id INT,
    ->     location_id INT
    -> );
Query OK, 0 rows affected (0.02 sec)
mysql> create table employees(employee_id int PRIMARY KEY AUTO_INCREMENT, names varchar(100), email varchar(50), phone varchar(50), salary int, department_id int);
Query OK, 0 rows affected (0.01 sec)

mysql> desc employees;
+---------------+--------------+------+-----+---------+----------------+
| Field         | Type         | Null | Key | Default | Extra          |
+---------------+--------------+------+-----+---------+----------------+
| employee_id   | int          | NO   | PRI | NULL    | auto_increment |
| names         | varchar(100) | YES  |     | NULL    |                |
| email         | varchar(50)  | YES  |     | NULL    |                |
| phone         | varchar(50)  | YES  |     | NULL    |                |
| salary        | int          | YES  |     | NULL    |                |
| department_id | int          | YES  |     | NULL    |                |
+---------------+--------------+------+-----+---------+----------------+
6 rows in set (0.00 sec)

a).

mysql> insert into departments values('','Human resource management',1,2);
Query OK, 1 row affected, 1 warning (0.00 sec)

mysql> select * from departments;
+---------------+---------------------------+------------+-------------+
| department_id | department_name           | manager_id | location_id |
+---------------+---------------------------+------------+-------------+
|             1 | Human resource management |          1 |           2 |
+---------------+---------------------------+------------+-------------+
1 row in set (0.00 sec)

mysql> insert into departments values('','ICT',3,1);
Query OK, 1 row affected, 1 warning (0.00 sec)

mysql> insert into departments values('','Finance',5,7);
Query OK, 1 row affected, 1 warning (0.00 sec)

mysql> insert into departments values('','law',6,3);
Query OK, 1 row affected, 1 warning (0.00 sec)

mysql> insert into departments values('','sciences',7,9);
Query OK, 1 row affected, 1 warning (0.00 sec)

mysql> select * from departments;
+---------------+---------------------------+------------+-------------+
| department_id | department_name           | manager_id | location_id |
+---------------+---------------------------+------------+-------------+
|             1 | Human resource management |          1 |           2 |
|             2 | ICT                       |          3 |           1 |
|             3 | Finance                   |          5 |           7 |
|             4 | law                       |          6 |           3 |
|             5 | sciences                  |          7 |           9 |
+---------------+---------------------------+------------+-------------+
5 rows in set (0.00 sec)

mysql> insert into employees values('','Eric NIYONSHUTI','eric@gmail.com','+25087422367',500000,1);
Query OK, 1 row affected, 1 warning (0.00 sec)

mysql> insert into employees values('','Jeane MUNEZERO','jeane@gmail.com','+25087427657',300000,3);
Query OK, 1 row affected, 1 warning (0.00 sec)

mysql> insert into employees values('','Evode NIYONKURU','evode@gmail.com','+250785433678',200000,1);
Query OK, 1 row affected, 1 warning (0.00 sec)

mysql> insert into employees values('','Elisa NDAYISASBA','elisa@gmail.com','+25078547633678',700000,4);
Query OK, 1 row affected, 1 warning (0.00 sec)

mysql> insert into employees values('','Emmanuel TUYIZERE','emmanuel@gmail.com','+250786563378',900000,5);
Query OK, 1 row affected, 1 warning (0.00 sec)


mysql> select * from employees;
+-------------+-------------------+--------------------+-----------------+--------+---------------+
| employee_id | names             | email              | phone           | salary | department_id |
+-------------+-------------------+--------------------+-----------------+--------+---------------+
|           1 | Eric NIYONSHUTI   | eric@gmail.com     | +25087422367    | 500000 |             1 |
|           2 | Jeane MUNEZERO    | jeane@gmail.com    | +25087427657    | 300000 |             3 |
|           3 | Evode NIYONKURU   | evode@gmail.com    | +250785433678   | 200000 |             1 |
|           4 | Elisa NDAYISASBA  | elisa@gmail.com    | +25078547633678 | 700000 |             4 |
|           5 | Emmanuel TUYIZERE | emmanuel@gmail.com | +250786563378   | 900000 |             5 |
+-------------+-------------------+--------------------+-----------------+--------+---------------+
5 rows in set (0.00 sec)


b)

mysql> desc employees;
+---------------+--------------+------+-----+---------+----------------+
| Field         | Type         | Null | Key | Default | Extra          |
+---------------+--------------+------+-----+---------+----------------+
| employee_id   | int          | NO   | PRI | NULL    | auto_increment |
| names         | varchar(100) | YES  |     | NULL    |                |
| email         | varchar(50)  | YES  |     | NULL    |                |
| phone         | varchar(50)  | YES  |     | NULL    |                |
| salary        | int          | YES  |     | NULL    |                |
| department_id | int          | YES  |     | NULL    |                |
+---------------+--------------+------+-----+---------+----------------+
6 rows in set (0.00 sec)

c)

mysql> select employees.names, departments.department_name from employees left outer join departments on employees.department_id = departments.department_id;
+-------------------+---------------------------+
| names             | department_name           |
+-------------------+---------------------------+
| Eric NIYONSHUTI   | Human resource management |
| Jeane MUNEZERO    | Finance                   |
| Evode NIYONKURU   | Human resource management |
| Elisa NDAYISASBA  | law                       |
| Emmanuel TUYIZERE | sciences                  |
+-------------------+---------------------------+
5 rows in set (0.00 sec)

d)


mysql> select employees.names, departments.department_name from employees right outer join departments on employees.department_id = departments.department_id;
+-------------------+---------------------------+
| names             | department_name           |
+-------------------+---------------------------+
| Evode NIYONKURU   | Human resource management |
| Eric NIYONSHUTI   | Human resource management |
| NULL              | ICT                       |
| Jeane MUNEZERO    | Finance                   |
| Elisa NDAYISASBA  | law                       |
| Emmanuel TUYIZERE | sciences                  |
+-------------------+---------------------------+
6 rows in set (0.00 sec)

e)

mysql> SELECT * FROM employees WHERE salary > (SELECT AVG(salary) FROM employees);
+-------------+-------------------+--------------------+-----------------+--------+---------------+
| employee_id | names             | email              | phone           | salary | department_id |
+-------------+-------------------+--------------------+-----------------+--------+---------------+
|           4 | Elisa NDAYISASBA  | elisa@gmail.com    | +25078547633678 | 700000 |             4 |
|           5 | Emmanuel TUYIZERE | emmanuel@gmail.com | +250786563378   | 900000 |             5 |
+-------------+-------------------+--------------------+-----------------+--------+---------------+
2 rows in set (0.01 sec)


Q7.

mysql> create table student(studentId varchar(5) PRIMARY KEY, fullnames varchar(25), gender varchar(6), age int(2), department varchar(30));
Query OK, 0 rows affected, 1 warning (0.02 sec)



mysql> insert into student values('001','Ange NIYIGENA','female',25,'BIT');
Query OK, 1 row affected (0.00 sec)

mysql> insert into student values('002','Alice UWERA','female',27,'ACC');
Query OK, 1 row affected (0.00 sec)

mysql> insert into student values('003','Seth NIYOMUGABO','male',21,'pharmacy');
Query OK, 1 row affected (0.00 sec)

mysql> insert into student values('004','Sammuel NIYIKIZA','male',20,'LTM');
Query OK, 1 row affected (0.00 sec)


1.


mysql> create view liste_of_students as select * from student;
Query OK, 0 rows affected (0.01 sec)

mysql> select * from liste_of_students;
+-----------+------------------+--------+------+------------+
| studentId | fullnames        | gender | age  | department |
+-----------+------------------+--------+------+------------+
| 001       | Ange NIYIGENA    | female |   25 | BIT        |
| 002       | Alice UWERA      | female |   27 | ACC        |
| 003       | Seth NIYOMUGABO  | male   |   21 | pharmacy   |
| 004       | Sammuel NIYIKIZA | male   |   20 | LTM        |
+-----------+------------------+--------+------+------------+
4 rows in set (0.01 sec)

2.

mysql> create view list_of_girls as select * from student where gender = 'female';
Query OK, 0 rows affected (0.01 sec)

mysql> select * from list_of_girls;
+-----------+---------------+--------+------+------------+
| studentId | fullnames     | gender | age  | department |
+-----------+---------------+--------+------+------------+
| 001       | Ange NIYIGENA | female |   25 | BIT        |
| 002       | Alice UWERA   | female |   27 | ACC        |
+-----------+---------------+--------+------+------------+
2 rows in set (0.00 sec)


3.

mysql> create view list_of_boys as select * from student where gender = 'male';
Query OK, 0 rows affected (0.01 sec)

mysql> select * from list_of_boys;
+-----------+------------------+--------+------+------------+
| studentId | fullnames        | gender | age  | department |
+-----------+------------------+--------+------+------------+
| 003       | Seth NIYOMUGABO  | male   |   21 | pharmacy   |
| 004       | Sammuel NIYIKIZA | male   |   20 | LTM        |
+-----------+------------------+--------+------+------------+
2 rows in set (0.00 sec)


4.

mysql> insert into student values('005','Enock NIYONKURU','male',15,'BIT');
Query OK, 1 row affected (0.00 sec)

mysql> select * from student;
+-----------+------------------+--------+------+------------+
| studentId | fullnames        | gender | age  | department |
+-----------+------------------+--------+------+------------+
| 001       | Ange NIYIGENA    | female |   25 | BIT        |
| 002       | Alice UWERA      | female |   27 | ACC        |
| 003       | Seth NIYOMUGABO  | male   |   21 | pharmacy   |
| 004       | Sammuel NIYIKIZA | male   |   20 | LTM        |
| 005       | Enock NIYONKURU  | male   |   15 | BIT        |
+-----------+------------------+--------+------+------------+
5 rows in set (0.00 sec)

5.

mysql> delete from student where age < 20;
Query OK, 1 row affected (0.00 sec)

mysql> select * from student;
+-----------+------------------+--------+------+------------+
| studentId | fullnames        | gender | age  | department |
+-----------+------------------+--------+------+------------+
| 001       | Ange NIYIGENA    | female |   25 | BIT        |
| 002       | Alice UWERA      | female |   27 | ACC        |
| 003       | Seth NIYOMUGABO  | male   |   21 | pharmacy   |
| 004       | Sammuel NIYIKIZA | male   |   20 | LTM        |
+-----------+------------------+--------+------+------------+
4 rows in set (0.00 sec)

Q9.



mysql> CREATE TABLE employees2(employee_id INT AUTO_INCREMENT PRIMARY KEY, first_name VARCHAR(100) NOT NULL, last_name VARCHAR(100) NOT NULL, email VARCHAR(100) UNIQUE NOT NULL, phone_number VARCHAR(15), hire_date DATE NOT NULL, job_id VARCHAR(10) NOT NULL, salary DECIMAL(10, 2), commission_pct DECIMAL(5, 2),  manager_id INT, department_id INT);
Query OK, 0 rows affected (0.02 sec)

mysql> desc employees2;
+----------------+---------------+------+-----+---------+----------------+
| Field          | Type          | Null | Key | Default | Extra          |
+----------------+---------------+------+-----+---------+----------------+
| employee_id    | int           | NO   | PRI | NULL    | auto_increment |
| first_name     | varchar(100)  | NO   |     | NULL    |                |
| last_name      | varchar(100)  | NO   |     | NULL    |                |
| email          | varchar(100)  | NO   | UNI | NULL    |                |
| phone_number   | varchar(15)   | YES  |     | NULL    |                |
| hire_date      | date          | NO   |     | NULL    |                |
| job_id         | varchar(10)   | NO   |     | NULL    |                |
| salary         | decimal(10,2) | YES  |     | NULL    |                |
| commission_pct | decimal(5,2)  | YES  |     | NULL    |                |
| manager_id     | int           | YES  |     | NULL    |                |
| department_id  | int           | YES  |     | NULL    |                |
+----------------+---------------+------+-----+---------+----------------+
11 rows in set (0.00 sec)

mysql> insert into employees2 values('', 'Jeane', 'NISHIMWE', 'Jeane@gmail.com', '+250784567890', '2020-01-15', 'IT_PROG', 6000.00, 0.10,2, 1);
Query OK, 1 row affected, 1 warning (0.01 sec)

mysql> insert into employees2 values('', 'Ange', 'TUTISHIME', 'Ange@gmail.com', '+250787667890', '2019-03-22', 'HR_REP', 4500.00, 0.05, 1, 2);
Query OK, 1 row affected, 1 warning (0.00 sec)

mysql> insert into employees2 values('', 'Alice', 'NIYONSENGA', 'Alice@gmail.com', '+250783467890', '2021-07-30', 'IT_PROG', 5500.00,4, 1, 1);
Query OK, 1 row affected, 1 warning (0.00 sec)

mysql> insert into employees2 values('', 'Bob', 'TUYIZERE', 'Bob@gmail.com', '+250784539890', '2018-11-10', 'AD_VP', 9000.00, 0.7,7, 3);
Query OK, 1 row affected, 1 warning (0.00 sec)

mysql> insert into employees2 values('', 'Vital', 'NKUNDIMANA', 'Vital@gmail.com', '+250784567523', '2022-02-25', 'SA_REP', 4000.00, 0.08, 2, 4);
Query OK, 1 row affected, 1 warning (0.00 sec)
mysql> select * from employees2;
+-------------+------------+------------+-----------------+---------------+------------+---------+---------+----------------+------------+---------------+
| employee_id | first_name | last_name  | email           | phone_number  | hire_date  | job_id  | salary  | commission_pct | manager_id | department_id |
+-------------+------------+------------+-----------------+---------------+------------+---------+---------+----------------+------------+---------------+
|           1 | Jeane      | NISHIMWE   | Jeane@gmail.com | +250784567890 | 2020-01-15 | IT_PROG | 6000.00 |           0.10 |          2 |             1 |
|           2 | Ange       | TUTISHIME  | Ange@gmail.com  | +250787667890 | 2019-03-22 | HR_REP  | 4500.00 |           0.05 |          1 |             2 |
|           3 | Alice      | NIYONSENGA | Alice@gmail.com | +250783467890 | 2021-07-30 | IT_PROG | 5500.00 |           4.00 |          1 |             1 |
|           4 | Bob        | TUYIZERE   | Bob@gmail.com   | +250784539890 | 2018-11-10 | AD_VP   | 9000.00 |           0.70 |          7 |             3 |
|           5 | Vital      | NKUNDIMANA | Vital@gmail.com | +250784567523 | 2022-02-25 | SA_REP  | 4000.00 |           0.08 |          2 |             4 |
+-------------+------------+------------+-----------------+---------------+------------+---------+---------+----------------+------------+---------------+
5 rows in set (0.00 sec)


09. a) 
mysql> select employee_id, first_name, last_name, salary from employees2;
+-------------+------------+------------+---------+
| employee_id | first_name | last_name  | salary  |
+-------------+------------+------------+---------+
|           1 | Jeane      | NISHIMWE   | 6000.00 |
|           2 | Ange       | TUTISHIME  | 4500.00 |
|           3 | Alice      | NIYONSENGA | 5500.00 |
|           4 | Bob        | TUYIZERE   | 9000.00 |
|           5 | Vital      | NKUNDIMANA | 4000.00 |
+-------------+------------+------------+---------+
5 rows in set (0.00 sec)

b)
mysql> update employees2 set manager_id = 100 where manager_id in(2,7);
Query OK, 3 rows affected (0.00 sec)
Rows matched: 3  Changed: 3  Warnings: 0

mysql> select * from employees2;
+-------------+------------+------------+-----------------+---------------+------------+---------+---------+----------------+------------+---------------+
| employee_id | first_name | last_name  | email           | phone_number  | hire_date  | job_id  | salary  | commission_pct | manager_id | department_id |
+-------------+------------+------------+-----------------+---------------+------------+---------+---------+----------------+------------+---------------+
|           1 | Jeane      | NISHIMWE   | Jeane@gmail.com | +250784567890 | 2020-01-15 | IT_PROG | 6000.00 |           0.10 |        100 |             1 |
|           2 | Ange       | TUTISHIME  | Ange@gmail.com  | +250787667890 | 2019-03-22 | HR_REP  | 4500.00 |           0.05 |          1 |             2 |
|           3 | Alice      | NIYONSENGA | Alice@gmail.com | +250783467890 | 2021-07-30 | IT_PROG | 5500.00 |           4.00 |          1 |             1 |
|           4 | Bob        | TUYIZERE   | Bob@gmail.com   | +250784539890 | 2018-11-10 | AD_VP   | 9000.00 |           0.70 |        100 |             3 |
|           5 | Vital      | NKUNDIMANA | Vital@gmail.com | +250784567523 | 2022-02-25 | SA_REP  | 4000.00 |           0.08 |        100 |             4 |
+-------------+------------+------------+-----------------+---------------+------------+---------+---------+----------------+------------+---------------+
5 rows in set (0.00 sec)

mysql> select * from employees2 where manager_id = 100;
+-------------+------------+------------+-----------------+---------------+------------+---------+---------+----------------+------------+---------------+
| employee_id | first_name | last_name  | email           | phone_number  | hire_date  | job_id  | salary  | commission_pct | manager_id | department_id |
+-------------+------------+------------+-----------------+---------------+------------+---------+---------+----------------+------------+---------------+
|           1 | Jeane      | NISHIMWE   | Jeane@gmail.com | +250784567890 | 2020-01-15 | IT_PROG | 6000.00 |           0.10 |        100 |             1 |
|           4 | Bob        | TUYIZERE   | Bob@gmail.com   | +250784539890 | 2018-11-10 | AD_VP   | 9000.00 |           0.70 |        100 |             3 |
|           5 | Vital      | NKUNDIMANA | Vital@gmail.com | +250784567523 | 2022-02-25 | SA_REP  | 4000.00 |           0.08 |        100 |             4 |
+-------------+------------+------------+-----------------+---------------+------------+---------+---------+----------------+------------+---------------+
3 rows in set (0.00 sec)

mysql>


c)

mysql> select * from employees2 where salary >= 4800;
+-------------+------------+------------+-----------------+---------------+------------+---------+---------+----------------+------------+---------------+
| employee_id | first_name | last_name  | email           | phone_number  | hire_date  | job_id  | salary  | commission_pct | manager_id | department_id |
+-------------+------------+------------+-----------------+---------------+------------+---------+---------+----------------+------------+---------------+
|           1 | Jeane      | NISHIMWE   | Jeane@gmail.com | +250784567890 | 2020-01-15 | IT_PROG | 6000.00 |           0.10 |        100 |             1 |
|           3 | Alice      | NIYONSENGA | Alice@gmail.com | +250783467890 | 2021-07-30 | IT_PROG | 5500.00 |           4.00 |          1 |             1 |
|           4 | Bob        | TUYIZERE   | Bob@gmail.com   | +250784539890 | 2018-11-10 | AD_VP   | 9000.00 |           0.70 |        100 |             3 |
+-------------+------------+------------+-----------------+---------------+------------+---------+---------+----------------+------------+---------------+
3 rows in set (0.00 sec)

d)

mysql> update employees2 set last_name = 'AUSTIN' where employee_id = 4;
Query OK, 1 row affected (0.00 sec)
Rows matched: 1  Changed: 1  Warnings: 0

mysql> select * from employees2;
+-------------+------------+------------+-----------------+---------------+------------+---------+---------+----------------+------------+---------------+
| employee_id | first_name | last_name  | email           | phone_number  | hire_date  | job_id  | salary  | commission_pct | manager_id | department_id |
+-------------+------------+------------+-----------------+---------------+------------+---------+---------+----------------+------------+---------------+
|           1 | Jeane      | NISHIMWE   | Jeane@gmail.com | +250784567890 | 2020-01-15 | IT_PROG | 6000.00 |           0.10 |        100 |             1 |
|           2 | Ange       | TUTISHIME  | Ange@gmail.com  | +250787667890 | 2019-03-22 | HR_REP  | 4500.00 |           0.05 |          1 |             2 |
|           3 | Alice      | NIYONSENGA | Alice@gmail.com | +250783467890 | 2021-07-30 | IT_PROG | 5500.00 |           4.00 |          1 |             1 |
|           4 | Bob        | AUSTIN     | Bob@gmail.com   | +250784539890 | 2018-11-10 | AD_VP   | 9000.00 |           0.70 |        100 |             3 |
|           5 | Vital      | NKUNDIMANA | Vital@gmail.com | +250784567523 | 2022-02-25 | SA_REP  | 4000.00 |           0.08 |        100 |             4 |
+-------------+------------+------------+-----------------+---------------+------------+---------+---------+----------------+------------+---------------+
5 rows in set (0.00 sec)

mysql> select * from employees2 where last_name = 'austin';
+-------------+------------+-----------+---------------+---------------+------------+--------+---------+----------------+------------+---------------+
| employee_id | first_name | last_name | email         | phone_number  | hire_date  | job_id | salary  | commission_pct | manager_id | department_id |
+-------------+------------+-----------+---------------+---------------+------------+--------+---------+----------------+------------+---------------+
|           4 | Bob        | AUSTIN    | Bob@gmail.com | +250784539890 | 2018-11-10 | AD_VP  | 9000.00 |           0.70 |        100 |             3 |
+-------------+------------+-----------+---------------+---------------+------------+--------+---------+----------------+------------+---------------+
1 row in set (0.00 sec)

e)

mysql> update employees2 set department_id = 60 where employee_id = 1;
Query OK, 1 row affected (0.00 sec)
Rows matched: 1  Changed: 1  Warnings: 0

mysql> update employees2 set department_id = 70 where employee_id = 3;
Query OK, 1 row affected (0.00 sec)
Rows matched: 1  Changed: 1  Warnings: 0

mysql> update employees2 set department_id = 80 where employee_id = 5;
Query OK, 1 row affected (0.00 sec)
Rows matched: 1  Changed: 1  Warnings: 0

mysql> select * from employees2 where department in(60,70,80);
ERROR 1054 (42S22): Unknown column 'department' in 'where clause'
mysql> select * from employees2 where department_id in(60,70,80);
+-------------+------------+------------+-----------------+---------------+------------+---------+---------+----------------+------------+---------------+
| employee_id | first_name | last_name  | email           | phone_number  | hire_date  | job_id  | salary  | commission_pct | manager_id | department_id |
+-------------+------------+------------+-----------------+---------------+------------+---------+---------+----------------+------------+---------------+
|           1 | Jeane      | NISHIMWE   | Jeane@gmail.com | +250784567890 | 2020-01-15 | IT_PROG | 6000.00 |           0.10 |        100 |            60 |
|           3 | Alice      | NIYONSENGA | Alice@gmail.com | +250783467890 | 2021-07-30 | IT_PROG | 5500.00 |           4.00 |          1 |            70 |
|           5 | Vital      | NKUNDIMANA | Vital@gmail.com | +250784567523 | 2022-02-25 | SA_REP  | 4000.00 |           0.08 |        100 |            80 |
+-------------+------------+------------+-----------------+---------------+------------+---------+---------+----------------+------------+---------------+
3 rows in set (0.00 sec)

Q10.
a)

mysql> CREATE TABLE sales(salesNo INT AUTO_INCREMENT PRIMARY KEY, salesName VARCHAR(100) NOT NULL, branch VARCHAR(50), salesAmount DECIMAL(10, 2), DOB DATE);
Query OK, 0 rows affected (0.02 sec)

mysql> desc sales;
+-------------+---------------+------+-----+---------+----------------+
| Field       | Type          | Null | Key | Default | Extra          |
+-------------+---------------+------+-----+---------+----------------+
| salesNo     | int           | NO   | PRI | NULL    | auto_increment |
| salesName   | varchar(100)  | NO   |     | NULL    |                |
| branch      | varchar(50)   | YES  |     | NULL    |                |
| salesAmount | decimal(10,2) | YES  |     | NULL    |                |
| DOB         | date          | YES  |     | NULL    |                |
+-------------+---------------+------+-----+---------+----------------+
5 rows in set (0.00 sec)

mysql> insert into sales values('','john','kagugu','200','2025-01-06');
Query OK, 1 row affected, 1 warning (0.00 sec)

mysql> insert into sales values('','ange','kacyiru','700','2025-01-07');
Query OK, 1 row affected, 1 warning (0.00 sec)

mysql> insert into sales values('','claude','nyamirambo','1000','2025-12-01');
Query OK, 1 row affected, 1 warning (0.00 sec)

mysql> insert into sales values('','kazungu','kinyinya','8000','2025-01-08');
Query OK, 1 row affected, 1 warning (0.00 sec)

mysql> insert into sales values('','luise','gisozi','100000','2025-12-20');
Query OK, 1 row affected, 1 warning (0.00 sec)

mysql> select * from sales;
+---------+-----------+------------+-------------+------------+
| salesNo | salesName | branch     | salesAmount | DOB        |
+---------+-----------+------------+-------------+------------+
|       2 | john      | kagugu     |      200.00 | 2025-01-06 |
|       3 | ange      | kacyiru    |      700.00 | 2025-01-07 |
|       4 | claude    | nyamirambo |     1000.00 | 2025-12-01 |
|       5 | kazungu   | kinyinya   |     8000.00 | 2025-01-08 |
|       6 | luise     | gisozi     |   100000.00 | 2025-12-20 |
+---------+-----------+------------+-------------+------------+
5 rows in set (0.00 sec)

b)
mysql> select branch, sum(salesAmount) from sales group by branch;
+------------+------------------+
| branch     | sum(salesAmount) |
+------------+------------------+
| kagugu     |           200.00 |
| kacyiru    |           700.00 |
| nyamirambo |          1000.00 |
| kinyinya   |          8000.00 |
| gisozi     |        100000.00 |
+------------+------------------+
5 rows in set (0.00 sec)

c)

mysql> select branch, avg(salesAmount) from sales group by branch;
+------------+------------------+
| branch     | avg(salesAmount) |
+------------+------------------+
| kagugu     |       200.000000 |
| kacyiru    |       700.000000 |
| nyamirambo |      1000.000000 |
| kinyinya   |      8000.000000 |
| gisozi     |    100000.000000 |
+------------+------------------+
5 rows in set (0.01 sec)

d)

mysql> update sales set DOB = 'first-Dec-2025' where salesNo = 5;
Query OK, 1 row affected (0.00 sec)
Rows matched: 1  Changed: 1  Warnings: 0
mysql> select * from sales where DOB like 'f%';
+---------+-----------+----------+-------------+----------------+
| salesNo | salesName | branch   | salesAmount | DOB            |
+---------+-----------+----------+-------------+----------------+
|       5 | kazungu   | kinyinya |     8000.00 | first-Dec-2025 |
+---------+-----------+----------+-------------+----------------+
1 row in set (0.00 sec)


e)

mysql> update sales set DOB = '21-Dec-2025' where salesNo = 4;
Query OK, 1 row affected (0.00 sec)
Rows matched: 1  Changed: 1  Warnings: 0

mysql> update sales set DOB = '20-Dec-2025' where salesNo = 6;
Query OK, 1 row affected (0.00 sec)
Rows matched: 1  Changed: 1  Warnings: 0

mysql> select * from sales;
+---------+-----------+------------+-------------+-------------+
| salesNo | salesName | branch     | salesAmount | DOB         |
+---------+-----------+------------+-------------+-------------+
|       2 | john      | kagugu     |      200.00 | 2025-01-06  |
|       3 | ange      | kacyiru    |      700.00 | 2025-01-07  |
|       4 | claude    | nyamirambo |     1000.00 | 21-Dec-2025 |
|       5 | kazungu   | kinyinya   |     8000.00 | 2025-01-08  |
|       6 | luise     | gisozi     |   100000.00 | 20-Dec-2025 |
+---------+-----------+------------+-------------+-------------+
5 rows in set (0.00 sec)
mysql> select * from sales where DOB like '___D%';
+---------+-----------+------------+-------------+-------------+
| salesNo | salesName | branch     | salesAmount | DOB         |
+---------+-----------+------------+-------------+-------------+
|       4 | claude    | nyamirambo |     1000.00 | 21-Dec-2025 |
|       6 | luise     | gisozi     |   100000.00 | 20-Dec-2025 |
+---------+-----------+------------+-------------+-------------+
2 rows in set (0.00 sec)







